product_id,product_name,description,price
1,focus,Raise social seven value through let life.,39.18
2,yard,Its western hold event nature by.,76.84
3,see,Contain along time together sign let realize.,41.94
4,no,Check agreement story wind.,68.97
5,hundred,Could edge system relationship evidence less system.,52.77
6,your,Back late just.,53.99
7,discussion,Month sport ever program follow identify nearly whom.,12.7
8,travel,Ok series head note beyond.,95.86
9,type,Person official quickly level.,15.07
10,realize,During option general positive only around contain.,5.0
11,develop,Day sister each.,82.44
12,along,Experience eight rather enough.,9.24
13,plant,Her million result week part office forward.,59.8
14,personal,Kind far opportunity high.,53.91
15,bad,Make lay value around best concern maybe.,75.48
16,fire,Expect relationship black four laugh.,25.29
17,study,Audience into simple say.,27.56
18,mouth,American maintain able show building.,20.47
19,throw,Condition region truth woman.,52.83
20,yourself,About significant environmental his third.,25.69
21,accept,Color stock foreign upon color song ten.,49.94
22,form,Expect minute government ball.,78.27
23,often,Benefit glass Congress yard suddenly book final.,34.0
24,protect,Rich compare pattern short task.,32.86
25,hand,Even hot central bad share.,34.7
26,condition,Threat international matter like civil dog.,15.58
27,now,Age senior four door.,70.76
28,treat,Those choose meeting research better training section present.,15.23
29,technology,Guess money finish system yard me indeed.,61.08
30,window,Owner hair agreement break actually.,7.85
31,claim,Brother computer write hard human miss bank maintain.,92.47
32,human,Market mission and.,81.54
33,now,Mention rather key yard.,16.4
34,ever,Art manage never hour these movement position.,17.49
35,cut,Book prepare stage movement.,99.08
36,however,Actually attention day both growth drive cell.,96.96
37,several,Three past manager common officer key.,95.79
38,others,Group as born.,66.02
39,pattern,Way wrong blue yourself continue Congress let.,19.57
40,certainly,Number federal thousand win return field assume.,60.57
41,class,Everything wonder career ground actually hundred hard.,64.96
42,customer,Rather none marriage century carry.,83.02
43,account,Forward research ever respond take small economic during.,37.78
44,attention,Finally wall probably social economic either.,5.43
45,response,Office rest receive paper.,83.02
46,thing,Food majority strong general material.,13.87
47,again,Senior education Democrat sport say wide rich.,25.73
48,late,Difference water music development unit.,5.14
49,its,Set wish dog cut.,91.32
50,would,Expect force of worker health.,32.86
